{
  "schemaVersion": "1.0",
  "contractType": "VALIDATION_RESULT",
  "requestId": "11111111-1111-4111-8111-111111111111",
  "planVersionId": "22222222-2222-4222-8222-222222222222",
  "validatedAt": "2026-09-15T00:00:03.000Z",
  "validatorVersion": "aps-validator-v1",
  "validationScope": "PUBLISH_PRECHECK",
  "definitionRevision": 7,
  "executionRevision": 3,
  "inputHash": "4ce6e395cf7724ba319cb609f9900c8ebca8c71f8aa8ee97fd720a8043e7d0b6",
  "candidateHash": "15212053fb85d13120b2ac44e7e0099c5b4e0a5d26b963443de77afcd8227711",
  "validationStatus": "PASS",
  "publishable": true,
  "problems": []
}
